{
  "$schema": "http://json-schema.org/draft-07/schema#",
  "title": "src/data/imtech_students.json",
  "type": "object",
  "properties": {
    "$schema": {
      "type": "string"
    },
    "_help": {
      "type": "array",
      "items": {
        "type": "string"
      },
      "description": "Notes for whoever edits this file. Ignored when the site is built."
    },
    "b24": {
      "type": "array",
      "items": {
        "type": "string"
      }
    },
    "b25": {
      "type": "array",
      "items": {
        "type": "string"
      }
    },
    "b26": {
      "type": "array",
      "items": {
        "type": "string"
      }
    }
  },
  "additionalProperties": false
}
