{
  "$schema": "./_schema/imtech_students.json",
  "_help": [
    "imtech students grouped by admission batch.",
    "Each key (b19, b20, ...) becomes one tab; the list under it is the names.",
    "Add a new batch by copying a block and giving it the next key."
  ],
  "b24": [
    "Anoop V",
    "Miriam Amirtha Mary T",
    "Divyansh",
    "Rasina R",
    "Ananthakrishnan V S",
    "Sakshi Pandey",
    "Vimal Shukla",
    "Sreedarsh N",
    "Aden Arun",
    "Jadhav Saniya Suresh",
    "Soumik Paul",
    "Edrin M C",
    "M Vethikha",
    "Amar Surya Pramod V K",
    "Kamali",
    "Abhay M",
    "Bushra Naaz",
    "Suhani Sabharwal"
  ],
  "b25": [
    "Amirthavarshini C",
    "Anu Vargheese K",
    "Bhuvaneshwari Devi Mathamala",
    "Girinath Balasubramaniam",
    "Harini R K",
    "Hridya S Menon",
    "Jethindas V",
    "Kain C Ajith",
    "Karthik Krishnan S",
    "Katika Sai Rakesh",
    "Kunku Penchala Prasad",
    "Mahadev E S",
    "Mani Shankar K",
    "Milan Sreekanth",
    "Muhammed Sinan K",
    "Nallapareddy Kishore Kumar Reddy",
    "Nayana  Sageesh V",
    "Nibin Sunny",
    "Shalini M",
    "Tanguturi Shiva Sai Teja",
    "Taniskha Soni",
    "Urmee Mishra",
    "VISAK K V",
    "YAKKALA VENKATA LAKSHMI SARVANI",
    "Bharat Ram Devajee"
  ],
  "b26": [
    "Abhijith Viju",
    "Abhimanyu Rajpurohit",
    "Abhishek Chouhan",
    "Adithyan R",
    "Aditya pratap singh",
    "Amal Sakalle",
    "Amit Vasudev Niju",
    "Artika Kumari",
    "Prachi Joshi",
    "Ashish Bharti",
    "Ayan Khatua",
    "Badharikes S",
    "Delwin K Biju",
    "Devathi Shashank",
    "Dhyan krishnan",
    "Gajulapalli Sruthi",
    "Jesna",
    "Sreehari Bibin",
    "Karaka Gowri Gyanesh",
    "Karthik k",
    "Krishna H A",
    "krishnapriyanm",
    "M S Mounika",
    "M Siddhartha Reddy",
    "Mathubala T",
    "Monish S",
    "Jerin Jojy",
    "Navya V C",
    "Piyo Rose Abraham",
    "Pratistha Singh",
    "Rameshkumar MV",
    "Remy Shajahan Kunju",
    "Sai Sukruthi Sammeta",
    "Sri Subhashini Pathuri",
    "Srujana Joshi",
    "Varnitha Mantrala",
    "Akash J",
    "Ayush R",
    "Charukesh R",
    "Hari Haran Sringari",
    "Kartik",
    "Sarveshwarran R B",
    "Adharsh Mohan",
    "Joyal Baby "
  ]
}
